,nombre,area_responsable,licitacion_oferta_empresa,attr4,monto_contrato,attr6,attr7,entorno,lat,lng
,CONSTRUCCION TRAMO DE MURO PERIMETRAL DEL CEMENTERIO MUNICIPAL,SERVICIOS PUBLICOS,PF COMPAÑIA CONSTRUCTORA S.A.,3071101956,"$ 2,250,000.00",147,"$2,149,974.13","MARIANO PELLIZA 3100, OLIVOS",-34.516235,-58.506568
,PUESTA EN VALOR ENTORNO ZUFRIATEGUI Y AV. MITRE,SERVICIOS PUBLICOS,PF COMPAÑIA CONSTRUCTORA S.A.,3071101956,"$ 5,500,000.00",128,"$6,488,591.70","AV. BARTOLOME MITRE Y ZUFRIATEGUI, VILLA MARTELLI",-34.549188,-58.500527
,PLAZOLETA GASPAR CAMPOS,SERVICIOS PUBLICOS,KIDE CONSTRUCCIONES S.R.L.,3071151035,"$ 1,200,000.00",38,"$1,205,114.60",GASPAR CAMPOS E/ LAPRIDA Y VIAS DEL FFCC BELGRANO,-34.533925,-58.471993
,ENTORNO OMBU,SERVICIOS PUBLICOS,KIDE CONSTRUCCIONES S.R.L.,3071151035,"$ 1,200,000.00",33,"$1,200,000.00",GASPAR CAMPOS E/ LAPRIDA Y VIAS DEL FFCC BELGRANO,-34.533925,-58.471993
,ENTORNO ESCALERA ROCA,SERVICIOS PUBLICOS,PANIZZA GABRIEL,2021762726,"$ 1,200,000.00",23,"$1,200,000.00",ROCA Y E. MADERO,-34.524328,-58.477316
,"PARQUE TEMATICO TECNOPOLIS TRABAJOS DE CORTE AL RAZ, DESPUNTE Y PODA DE EJEMPLARES ARBOREOS",SERVICIOS PUBLICOS,TE ILUMINA,3070960632,"$ 1,220,400.00",29,"$1,220,400.00",TECNOPOLIS,-34.560685,-58.506070
,"MANTENIMIENTO DEL ARBOLADO URBANO, RALEO DE ARBOLES ZONA 1",SERVICIOS PUBLICOS,VERDE INTEGRAL,3071426384,"$ 7,000,000.00",56,"$3,500,000.00",VICENTE LOPEZ,-34.511135,-58.490334
,"MANTENIMIENTO DEL ARBOLADO URBANO, RALEO DE ARBOLES ZONA 2",SERVICIOS PUBLICOS,CASA MACCHI S.A.,3060812520,"$ 7,000,000.00",56,"$3,500,000.00",VICENTE LOPEZ,-34.511135,-58.490334
,DESPUNTE DE EJEMPLARES ARBOREOS UBICADOS EN EL PREDIO DE TECNOPOLIS,SERVICIOS PUBLICOS,TE ILUMINA,3070960632,"$ 1,227,600.00",25,"$1,227,600.00",TECNOPOLIS,-34.560685,-58.506070
,EXTRACCION EJEMPLARES ARBOREOS NO APTOS PARA SU PERMANENCIA EN LA VIA PUBLICA,SERVICIOS PUBLICOS,CASA MACCHI S.A.,3060812520,"$ 1,200,000.00",39,"$1,200,000.00",VICENTE LOPEZ,-34.511135,-58.490334
,PROVISION Y COLOCACION DE EQUIPAMIENTO EN LA LOCALIDAD DE FLORIDA,SERVICIOS PUBLICOS,RIPANI JOSE,2312639353,"$ 1,250,000.00",56,"$1,249,199.00",ENTORNO ARISTOBULO           DEL VALLE,-34.537157,-58.478191
,EJECUCION DE SOLADOS ENTORNO BOULEVARD ARISTOBULO DEL VALLE,SERVICIOS PUBLICOS,RIPANI JOSE,2312639353,"$ 1,206,253.00",38,"$1,206,253.08",ENTORNO ARISTOBULO           DEL VALLE,-34.537294,-58.478078
,PUESTA  EN VALOR ENTORNO ESCALERA CALLE PENNA Y MADERO,SERVICIOS PUBLICOS,SALBACO S.A.,3071543177,"$ 5,000,000.00",100,"$5,492,855.27",DR. JOSE PENNA Y MADERO,-34.525265,-58.476656
,PUESTA EN VALOR Y AMPLIACIÓN DE JARDÍN DE INFANTES Y CBI BARRIO HABANA,VIVIENDA SOCIAL,MERLINO LUIS ALBERTO,2010365277,"$ 11,144,790.00",385,"$12,088,279.89","HABANA 171, VILLA MARTELLI",-34.556194,-58.518761
,INSTALACION DE ALUMBRADO PUBLICO EN EL BARRIO EL CEIBO,ELECTROMECANICA,MANTELECTRIC I.C.I.S.A.,3052029200,"$ 1,461,000.00",37,"$1,453,469.00",BROWN RIO DE LA PLATA Y RAMSEYER LA LUCILA,-34.493903,-58.480743
,INSTALACION DE ALUMBRADO PUBLICO EN PLAZA VALDIVIESO,ELECTROMECANICA,MANTELECTRIC I.C.I.S.A.,3052029200,"$ 1,080,000.00",24,"$1,050,300.00","JUAN BAUTISTA JUSTO 3002, OLIVOS",-34.514744,-58.505604
,INSTALACION DE ALUMBRADO PUBLICO EN PLAZA MILENIO,ELECTROMECANICA,MANTELECTRIC I.C.I.S.A.,3052029200,"$ 990,000.00",117,"$978,295.00","FLORIDA 1800, OLIVOS",-34.51746,-58.491147
,TRATAMIENTO ANTIVANDALICO Y PINTURA PARA COLUMNAS DE ALUMBRADO PUBLICO EN DISTINTAS CALLES DEL PARTIDO,ELECTROMECANICA,CORPAL S.R.L.,3069629246,"$ 6,580,000.00",109,"$6,297,290.00",OLIVOS FLORIDA VILLA MARTELLI LA LUCILA VTE. LOPEZ CARAPACHAY MUNRO,-34.511135,-58.490334
,REMODELACION E INSTALACION DE ALUMBRADO PUBLICO EN PASEO DEL VIENTO,ELECTROMECANICA,MANTELECTRIC I.C.I.S.A.,3052029200,"$ 890,000.00",127,"$860,274.00",BORGES Y RIO DE LA PLATA,-34.500195,-58.477655
,PROVISION DE ARTEFACTOS Y BRAZOS PLAN DE LUMINARIAS ETAPA 3,ELECTROMECANICA,STRAND S.A.,3060707312,"$ 13,399,978.00",83,"$13,253,200.00",OLIVOS FLORIDA VILLA MARTELLI LA LUCILA VTE. LOPEZ CARAPACHAY MUNRO,-34.511135,-58.490334
,EJECUCION DE NUEVO SUM EN EL INSTITUTO BIGNONE,SALUD,KANRE S.A.,3071426897,"$ 1,800,000.00",115,"$ 1,800,344.10","MARTIN HAEDO 1426, OLIVOS",-34.528159,-58.479668
,PUESTA EN VALOR DE LA CASONA DEL INSTITUTO BIGNONE,SALUD,INGECONS S.A.,3068339933,"$ 4,700,000.00",147,"$ 4,582,286.23","MARTIN HAEDO 1426, OLIVOS",-34.528159,-58.479668
,EJECUCION DE PUNTO DIGITAL EN BARRIOS DE LA LOMA,OBRAS,PF COMPAÑIA CONSTRUCTORA S.A.,3071101956,"$ 10,000,000.00",249,"$10,797,805.64","CORONEL FRANCISCO UZAL Y EL PASAJE BEIRO, OLIVOS",-34.515906,-58.512950
,PUESTA EN VALOR PLAZOLETA DE LA COMUNIDAD,OBRAS,KANRE S.A.,3071426897,"$ 900,000.00",56,"$ 1,080,870.00","ALBERDI Y JOSE MARIA PAZ, OLIVOS",-34.514978,-58.500479
,PUESTA EN VALOR CENTRO COMERCIAL MUNRO ETAPA 2,OBRAS,CUNUMI S.A.,3061574803,"$ 21,000,000.00",316,"$ 23,535,000.00",MITRE DESDE ENTRE RIOS HASTA VELEZ SARSFIELD Y DESDE MARCONI HASTA MALAVER Y FELIU,-34.527328,-58.518054
,PROVISION Y COLOCACION DE EQUIPAMIENTO PARA LA PLANTA BAJA DEL PALACIO MUNICIPAL,OBRAS,PRODMOBI S.A.,3071006955,"$ 750,000.00",123,"$675,023.00","AV. MAIPU 2609, OLIVOS",-34.511135,-58.490334
,EJECUCION DE OFICINAS Y AREAS DE SERVICIO PARA LA SUBSECRETARIA DE SERVICIOS PUBLICOS,OBRAS,EIPORT S.A.,3071223966,"$ 9,000,000.00",460,"$10,499,743.39","BLANCO ENCALADA 1665, FLORIDA OESTE",-34.542519,-58.523921
,EJECUCION DE OFICINAS Y AREAS DE SERVICIO PARA LA SECRETARIA DE TRANSITO,OBRAS,ARQUINGHAM S.R.L.,3059846981,"$ 19,500,000.00",281,"$21,989,999.66","DORREGO 1765, OLIVOS",-34.510642,-58.495386
,PUESTA EN VALOR ENTORNO DEL INSTITUTO BIGNONE,OBRAS,KANRE S.A.,3071426897,"$ 1,300,000.00",88,"$ 1,309,448.57","MARTIN HAEDO 1426, OLIVOS",-34.528159,-58.479668
,"REFORMAS VARIAS EN EL CENTRO CAPACITACION CHILE 219, VILLA MARTELLI",EDUCACION,ONE TOWER S.R.L.,3071213279,"$ 2,100,000.00",74,"$ 2,179,679.23","CHILE 219, VILLA MARTELLI",-34.548178,-58.502931
,EJECUCION DE NUEVA COCINA EN EL INSTITUTO DORREGO,EDUCACION,FOCUS POINT S.A.,3070745182,"$ 800,000.00",94,"$ 840,838.00","GERVASIO POSADAS 115, FLORIDA OESTE",-34.540843,-58.523317
,REPARACIONES VARIAS Y PINTURA COMPLETA EN EL JARDIN DE INFANTES Nº2,EDUCACION,FOCUS POINT S.A.,3070745182,"$ 700,000.00",45,"$ 685,796.88","MONTES DE OCA 7040, MUNRO",-34.535986,-58.545407
,REPARACIONES VARIAS Y PINTURA EN EL JARDIN MATERNAL Nº2,EDUCACION,SALBACO S.A.,3071543177,"$ 2,500,000.00",203,"$ 2,846,602.75","JOSE INGENIEROS 3425, OLIVOS",-34.512077,-58.513503
,REPARACION DE HUMEDADES Y PINTURA COMPLETA EN EL JARDIN MATERNAL Nº6,EDUCACION,KANRE S.A.,3071426897,"$ 1,300,000.00",81,"$ 1,388,736.00","ECHEVERRIA 630, VILLA MARTELLI",-34.541459,-58.498901
,REMODELACION DE SANITARIOS Y REPARACION DE FILTRACIONES EN EL CENTRO DE CAPACITACION SANTIAGO RAINERO,EDUCACION,RIPANI JOSE,2312639353,"$ 1,000,000.00",53,"$ 995,329.10","ITUZAINGO 5442, CARAPACHAY",-34.528614,-58.532096
,REMODELACION EN OFICINAS DE LA SECRETARIA DE MODERNIZACION Y GOBIERNO DIGITAL,GOBIERNO,KANRE S.A.,3071426897,"$ 1,435,000.00",206,"$ 1,460,000.00","AV. MAIPU 2502, OLIVOS",-34.512417,-58.489968
,ADECUACION DE ESQUINAS ENTORNO A ESTABLECIMIENTOS EDUCATIVOS,TRANSITO,CUNUMI S.A.,3061574803,"$4,515,000.00",168,"$4,480,000.00",VICENTE LOPEZ,-34.511135,-58.490334
,EJECUCION DE NUEVA SALA DE INTERNACION EN LA MATERNIDAD SANTA ROSA,SALUD,KIDE CONSTRUCCIONES S.R.L.,3071151035,"$9,000,000.00",322,"$10,196,661.49","HAEDO 4150, FLORIDA OESTE",-34.543862,-58.512607
,PUESTA EN VALOR DE FACHADA Y HALL DE ACCESO EN LA MATERNIDAD SANTA ROSA,SALUD,KIDE CONSTRUCCIONES S.R.L.,3071151035,"$6,800,000.00",122,"$6,898,451.25","HAEDO 4150, FLORIDA OESTE",-34.543862,-58.512607
,PUESTA EN VALOR PLAZA VALDIVIELSO SAEZ,OBRAS,PF COMPAÑIA CONSTRUCTORA S.A.,3071101956,"$ 5,900,000.00",85,"$ 5,821,334.40","JUAN BAUTISTA JUSTO 3002, OLIVOS",-34.514744,-58.505604
,PROVISION Y COLOCACION DE PISO DRENANTE PARA CANIL EN PLAZA VALDIVIELSO SAEZ,OBRAS,REDES SUSTENTABLES S.R.L.,3071383400,"$ 765,000.00",34,"$ 655,741.14","JUAN BAUTISTA JUSTO 3002, OLIVOS",-34.514744,-58.505604
,PROVISION Y COLOCACION DE SOLADO ANTIGOLPES PARA LA PLAZA VALDIVIELSO  SAEZ,OBRAS,FLOOR SYSTEM S.A.,3071099979,"$ 450,000.00",20,"$ 444,181.64","JUAN BAUTISTA JUSTO 3002, OLIVOS",-34.514744,-58.505604
,EJECUCION DE FUENTE EN PLAZA VALDIVIELSO SAEZ,OBRAS,KANRE S.A.,3071426897,"$ 631,000.00",183,"$ 742,820.00","JUAN BAUTISTA JUSTO 3002, OLIVOS",-34.514744,-58.505604
,EJECUCION DE REJAS Y PORTONES EN EL RETEN HIDRAULICO FLORIDA OESTE,OBRAS,DERBAU S.A.,3071216646,"$ 4,241,601.00",98,"$ 3,610,178.29","CORNELIO SAAVEDRA 1901, FLORIDA OESTE",-34.539302,-58.522726
,PUESTA EN VALOR PLAZA DEL MILENIO,OBRAS,SALBACO S.A.,3071543177,"$ 4,300,000.00",216,"$ 4,214,066.80","FLORIDA 1800, OLIVOS",-34.51746,-58.491147
,REMODELACION DE HALL PRINCIPAL Y BAÑOS EN PLANTA BAJA DEL PALACIO MUNICIPAL,OBRAS,MARLE CONSTRUCCIONES S.A.,3356839753,"$ 6,700,000.00",178,"$ 7,370,624.35","AV. MAIPU 2609, OLIVOS",-34.511135,-58.490334
,REPARACIONES VARIAS EN CUBIERTAS DEL PALACIO MUNICIPAL,OBRAS,KIDE CONSTRUCCIONES S.R.L.,3071151035,"$ 1,200,000.00",172,"$ 1,197,397.77","AV. MAIPU 2609, OLIVOS",-34.511135,-58.490334
,PUESTA EN VALOR DEL ENTORNO AL PALACIO MUNICIPAL Y HCD,OBRAS,KIDE CONSTRUCCIONES S.R.L.,3071151035,"$ 1,200,000.00",151,"$1,349,861.16","AV. MAIPU 2609, OLIVOS",-34.511135,-58.490334
,REPARACION DE CONDUCTO PLUVIAL EN LA CALLE VALLE GRANDE ENTRE MELO Y HAEDO,OBRAS,C&E CONSTRUCCIONES S.A,3070828836,"$ 650,000.00",31,"$719,999.12","VALLE GRANDE 900, FLORIDA",-34.536828,-58.495794
,CONTRUCCION DE CONDUCTO PLUVIAL CALLE ITALIA,OBRAS,PF COMPAÑIA CONSTRUCTORA S.A.,3071101956,"$ 53,000,000.00",543,"$52,997,042.36",ITALIA ENTRE EL RIO DE LA PLATA Y SARMIENTO,-34.525917,-58.498592
,READECUACION CONDUCTO EN LA CALLE MANUEL GARCIA AL 5100,OBRAS,PF COMPAÑIA CONSTRUCTORA S.A.,3071101956,"$ 2,800,000.00",79,"$3,325,975.51","MANUEL GARCIA 5100, MUNRO",-34.519441,-58.531554
,"EJECUCION DE LIMPIEZA DE DESEMBOCADURA EN CALLES  MELO, BORGES, VILLATE - VICENTE LOPEZ",PLUVIALES - PAVIMENTO,CORPAL S.R.L.,3069629246,"$ 2,500,000.00",52,"$ 2,498,767.74","MELO, BORGES, VILLATE Y EL RIO, OLIVOS",-34.523911,-58.467881
,"FRESADO, CARPETA ASFALTICA Y BACHEO DE H° CALLE PARANA",PLUVIALES - PAVIMENTO,C&E CONSTRUCCIONES S.A,3070828836,"$ 41,847,000.00",182,"$ 36,606,668.01",PARANA DESDE EL RIO DE LA PLATA HASTA PRIMERA JUNTA,-34.530153,-58.553752
,PUESTA EN VALOR DE LA FACHADA JARDIN MATERNAL N° 8,EDUCACION,SALBACO S.A.,3071543177,"$ 380,000.00",142,"$ 380,020.37","SANTA ROSA 4148, FLORIDA OESTE",-34.542935,-58.513218
,EJECUCION DE VESTUARIOS EN PREDIO U23,DEPORTES,KIDE CONSTRUCCIONES S.R.L.,3071151035,"$ 5,600,000.00",42,"$5,995,292.44","SANTA CRUZ ESQUINA NEUQUEN, MUNRO",-34.539541,-58.536295
,REPARACION DE CORDONES Y TOMADO DE JUNTA PARA PUESTA EN VALOR PASEO DE LA COSTA,TRANSITO,SALBACO S.A.,3071543177,"$1,133,161.71",72,"$1,160,546.46",RICARDO ALFONSIN ENTRE YIRIGOYEN Y LAPRIDA,-34.515365,-58.472632
,PUESTA EN VALOR CASONA DE LA QUINTA TRABUCCO,CULTURA,RIPANI JOSE,2312639353,"$ 2,000,000.00",86,"$ 1,998,557.63","CARLOS FRANCISCO MELO 3050, FLORIDA",-34.538691,-58.498487
,AMPLIACION Y REMODELACION DE COCINA EN LA FUNDACION CAMINO,PRESUPUESTO PARTICIPATIVO,CONSPO S.A.,3069801480,"$1,000,000.00",147,"$998,331.50","ANTONIO MALAVER 1745, OLIVOS",-34.520216,-58.489993
,EJECUCION DE SOLADO EN GIMNASIO Y REPARACIONES VARIAS EN LA ESCUELA PRIMARIA Nº7,PRESUPUESTO PARTICIPATIVO,CONSPO S.A.,3069801480,"$900,000.00",112,"$885,444.42","FRANCISCO NARCISO LAPRIDA 3664, VILLA MARTELLI",-34.547461,-58.502808
,EJECUCION DE NUEVA SALA Y AMPLIACION DE SUM EN JARDIN MATERNAL Nº3,PRESUPUESTO PARTICIPATIVO,PROMETIN S.A.,3070851188,"$1,600,000.00",130,"$1,615,920.44","FRANKLIN 1785, FLORIDA OESTE",-34.539827,-58.520476
,EJECUCION DE SUM EN JARDIN INFANTES Nº3,PRESUPUESTO PARTICIPATIVO,RIPANI JOSE,2312639353,"$2,100,000.00",93,"$2,250,000.69","JOSE HERNANDEZ 4527, MUNRO",-34.528716,-58.523195
,PROVISION Y COLOCACION DE PISO DE GOMA EN SUM Y TAREAS DE PINTURA EN LA ESCUELA SECUNDARIA Nº3,PRESUPUESTO PARTICIPATIVO,SALBACO S.A.,3071543177,"$630,000.00",76,"$655,198.32","DRYSDALE 5646, CARAPACHAY",-34.527416,-58.535149
,AMPLIACION DE BIBLIOTECA EN LA ESCUELA PRIMARIA Nº18,PRESUPUESTO PARTICIPATIVO,SALBACO S.A.,3071543177,"$970,000.00",132,"$850,916.49","DRYSDALE 5615, CARAPACHAY",-34.527322,-58.534793
,REPARACIONES VARIAS EN LA ESCUELA Nº7 LUIS LELOIR,PRESUPUESTO PARTICIPATIVO,NAYMARK GERARDO,2010617279,"$1,180,000.00",121,"$1,180,000.00","ARENALES 1945, FLORIDA",-34.525747,-58.490022
,REFORMAS EN COCINA Y EJECUCION DE ESCENARIO EN ESCUELA PRIMARIA  Nº31,PRESUPUESTO PARTICIPATIVO,SALBACO S.A.,3071543177,"$850,000.00",134,"$890,168.67","FELIX DE AMADOR 3040, OLIVOS",-34.522264,-58.505821
,EJECUCION DE CERRAMIENTOS Y SOLADOS DE ESCUELA DE CAPACITACION DOCENTE Nº39,PRESUPUESTO PARTICIPATIVO,KANRE S.A.,3071426897,"$700,000.00",65,"$735,075.00","AGUSTIN ALVAREZ 1459, VICENTE LOPEZ",-34.533248,-58.478004
,EJECUCION DE ALEROS Y REPARACION DE MURO EXTERIOR EN LA ESCUELA PRIMARIA Nº8,PRESUPUESTO PARTICIPATIVO,SALBACO S.A.,3071543177,"$720,000.00",45,"$770,872.43","AV. MAIPU 1527, OLIVOS",-34.523645,-58.483513
,EJECUCION DE STAND GASTRONOMICO EN EL CENTRO RECREATIVO DE LA TERCERA EDAD,PRESUPUESTO PARTICIPATIVO,ZZ CONSTRUCCIONES S.R.L.,3071197187,"$750,000.00",113,"$899,017.35","JUAN CARLOS CRUZ 225, OLIVOS",-34.531555,-58.464904
,REPARACIONES EN LA CUBIERTA DEL SUM DE LA ESCUELA N° 28 JOSE HERNANDEZ,PRESUPUESTO PARTICIPATIVO,KANRE S.A.,3071426897,"$415,000.00",48,"$475,000.00","GOBERNADOR CASTRO 3720, VILLA ADELINA",-34.532553,-58.548771
,REMODELACION EN TALLER DE COCINA DE LA ESCUELA DE EDUCACION ESPECIAL N° 502,PRESUPUESTO PARTICIPATIVO,CONSTRUCCIONES LA LUCENA S.A.,3071567288,"$480,000.00",113,"$459,770.65","PEDRO GOYENA 3264, OLIVOS",-34.513254,-58.507341
,EJECUCION DE RAMPAS EN DIVERSAS LOCALIDADES DE VICENTE LOPEZ,PRESUPUESTO PARTICIPATIVO,CUNUMI S.A.,3061574803,"$810,000.00",192,"$797,076.71",VICENTE LOPEZ,-34.511135,-58.490334
,PROVISION DE LUMINARIAS PARA EL CENTRO COMERCIAL MUNRO ETAPA 2,OBRAS,OBRELECTRIC S.R.L.,3056202092,"$ 1,000,000.00",40,"$647,535.00",MITRE DESDE ENTRE RIOS HASTA VELEZ SARSFIELD Y DESDE MARCONI HASTA MALAVER Y FELIU,-34.527328,-58.518054
,PUESTA EN VALOR ESTACION ARISTOBULO DEL VALLE,OBRAS,PF - LIHUE UTE,3071475381,"$ 38,000,000.00",889,"$ 43,786,689.26","AV. MAIPU 30, OLIVOS",-34.537978,-58.476424
,REMODELACION DE BAÑOS Y PUESTA EN VALOR DE LA FACHADA EN FUNDACION CAMINO,PRESUPUESTO PARTICIPATIVO,RIPANI JOSE,2312639353,"$ 1,100,000.00",49,"$ 1,070,602.10","ANTONIO MALAVER 1745, OLIVOS",-34.520216,-58.489993
,EJECUCION DE CALZADA DE HORMIGON EN EL PREDIO DE LA DIRECCION DE HIGIENE URBANA,OBRAS,CASA MACCHI S.A.,3060812520,"$ 3,700,000.00",79,"$ 3,693,167.80","BLANCO ENCALADA 1665, FLORIDA OESTE",-34.542546,-58.523902
,"CONSTRUCCION DE 16 VIVIENDAS EN CONSTITUYENTES 489, VILLA MARTELLI",VIVIENDA SOCIAL,CUNUMI S.A.,3061574803,"$ 6,210,000.00",EN EJECUCION,"$ 6,770,000.00","AV. CONSTITUYENTES 489, VILLA MARTELLI",-34.55308,-58.522809
,SANEAMIENTO HIDRAULICO Y EJECUCION DE RED VIAL PERIMETRAL EN BARRIO EL CEIBO,PLUVIALES - PAVIMENTO,BOSQUIMANO S.A.,3071147002,"$ 23,500,000.00",353,"$ 28,533,310.22","BARRIO EL CEIBO, LA LUCILA",-34.493903,-58.480743
,CONSTRUCCION DE 48 VIVIENDAS EN EL BARRIO LAS FLORES,VIVIENDA SOCIAL,CUNUMI S.A.,3061574803,"$ 38,790,000.00",EN EJECUCION,"$ 45,963,000.00","JUANA AZURDUY 966, VILLA MARTELLI",-34.547704,-58.520361
,PUESTA EN VALOR BOULEVARD YRIGOYEN,OBRAS,ILUBAIRES S.A.,3069381186,"$ 11,500,000.00",228,"$ 11,466,936.97",H. YRIGOYEN ENTRE AV. DEL LIBERTADOR Y VIAL COSTERO,-34.51616,-58.474488
,INSTALACION DE ALUMBRADO PUBLICO EN DISTINTAS CALLES DEL PARTIDO,ELECTROMECANICA,MANTELECTRIC I.C.I.S.A.,3052029200,"$ 900,000.00",344,"$ 854,993.00",VICENTE LOPEZ,-34.511135,-58.490334
,EJECUCION DE RAMPA DE ACCESO VEHICULAR EN PREDIO U23,PLUVIALES - PAVIMENTO,PF COMPAÑIA CONSTRUCTORA S.A.,3071101956,"$ 1,200,000.00",21,"$ 1,195,966.40","SANTA CRUZ ESQUINA NEUQUEN, MUNRO",-34.539541,-58.536295
,READECUACION DE CONDUCTO PLUVIAL EN LA CALLE MANUEL GARCIA AL 5100,PLUVIALES - PAVIMENTO,PF COMPAÑIA CONSTRUCTORA S.A.,3071101956,"$ 2,800,000.00",79,"$ 3,325,975.51",MANUEL GARCIA ENTRE ARMENIA Y M. ACHA,-34.519163,-58.531208
,EJECUCION DE PARQUIZACION EN RETEN BELGRANO CARGAS,OBRAS,EMPRESA MANILA S.A.,3058380778,"$ 900,000.00",483,"$ 846,307.50","AV. GRAL. JOSE DE SAN MARTIN 3955, FLORIDA OESTE.",-34.538166,-58.513647
,REPARACION Y EJECUCION DE TECHOS EN BARRIO HABANA,VIVIENDA SOCIAL,ZZ CONSTRUCCIONES S.R.L.,3071197187,"$ 1,255,000.00",EN EJECUCION,"$ 1,231,230.00","HABANA 177, VILLA MARTELLI",-34.556175,-58.518863
,CONSTRUCCION DE 24 VIVIENDAS EN BARRIO 7 DE MAYO,VIVIENDA SOCIAL,CUNUMI S.A.,3061574803,"$ 22,224,000.00",EN EJECUCION,"$ 27,804,000.00","RAMON CASTRO 3467/75, OLIVOS",-58.512492,"-34.515007,"
,CONSTRUCCION DE 24 VIVIENDAS EN BARRIO GANDARA,VIVIENDA SOCIAL,CUNUMI S.A.,3061574803,"$ 23,615,000.00",EN EJECUCION,"$ 29,530,000.00",WARNES 3445,-34.512863,-58.51109
,PUESTA EN VALOR DEL PATIO INTERNO EN PLANTA BAJA DEL PALACIO MUNICIPAL,OBRAS,PROMETIN S.A.,3070851188,"$ 1,100,000.00",230,"$ 1,092,071.23","AV. MAIPU 2609, OLIVOS",-34.511135,-58.490334
,SANEAMIENTO HIDRAULICO ESTACION JUAN B. JUSTO,PLUVIALES - PAVIMENTO,C&E CONSTRUCCIONES S.A,3070828836,"$ 26,000,000.00",336,"$ 30,301,298.59",ESTACION JUAN B JUSTO,-34.542533,-58.494592
,"CONSTRUCCION DE UAP, CBI Y TALLERES BARRIO EL CEIBO",VIVIENDA SOCIAL,KIDE CONSTRUCCIONES S.R.L.,3071151035,"$ 6,493,868.97",150,"$ 6,493,868.97","BARRIO EL CEIBO, LA LUCILA",-34.493903,-58.480743
,EJECUCION DE NUEVO GERIATRICO MUNICIPAL RODRIGUEZ ORTEGA,OBRAS,AMG OBRAS CIVILES S.A.,3051996288,"$ 109,326,644.33",EN EJECUCION,"$ 129,890,652.00","MARIANO PELLIZA 2786, OLIVOS",-34.513892,-58.504261
,EJECUCION DE ACCESOS  Y SENDEROS EN RETEN BELGRANO CARGAS,OBRAS,PF COMPAÑIA CONSTRUCTORA S.A.,3071101956,"$ 2,850,000.00",213,"$ 2,842,692.72","AV. GRAL. JOSE DE SAN MARTIN 3955, FLORIDA OESTE.",-34.538166,-58.513647
,CONSTRUCCION DE ENTUBAMIENTO Y OBRAS COMPLEMENTARIAS ALIVIADOR LAVALLE,PLUVIALES - PAVIMENTO,CENTRO CONSTRUCCIONES S.A.,3060506247,"$ 300,000,000.00",EN EJECUCION,"$ 299,254,988.28",LAVALLE ENTRE EL RIO DE LA PLATA Y MADERO,-34.528648,-58.470627
,EJECUCION DE LIMPIEZA DE DESEMBOCADURA EN LA CALLE CORRIENTES,PLUVIALES - PAVIMENTO,CORPAL S.R.L.,3069629246,"$ 1,200,000.00",27,"$ 1,200,000.00",CORRIENTES Y EL RIO DE LA PLATA,-34.506687,-58.476022
,PROVISION E INSTALACION DE SISTEMA DE ENERGIA SOLAR PARA DEPENDENCIAS MUNICIPALES EN EL BARRIO EL CEIBO,VIVIENDA SOCIAL,LA INESINA S.R.L.,3070811819,"$ 1,205,000.00",38,"$ 1,117,417.00","BARRIO EL CEIBO, LA LUCILA",-34.493903,-58.480743
,CONSTRUCCION DE CRUCE BAJO NIVEL VIAS DEL FERROCARRIL BELGRANO ENTRE CALLE VILLATE Y MARCONI,PLUVIALES - PAVIMENTO,CONSTRUMEX S.A.,3069639421,"$ 164,124,966.30",540,"$ 163,799,265.42",ESTACION MUNRO DEL FERROCARRIL BELGRANO,-34.532031,-58.522815
,MODERNIZACION DEL ALUMBRADO PUBLICO,ELECTROMECANICA,DATANDHOME SUPPLIER S.A.,3070806550,"$ 149,500,000.00",EN EJECUCION,"$ 119,975,767.61",VICENTE LOPEZ,-34.511135,-58.490334
,REPARACION DE CONDUCTOS PLUVIALES EN LA CALLE ESPAÑA Y VERGARA Y EN LA CALLE H. YRIGOYEN Y JOSE MARIA PAZ,PLUVIALES - PAVIMENTO,SALBACO S.A.,3071543177,"$ 1,000,000.00",77,"$ 1,025,740.41",ESPAÑA Y VERGARA; H.YRIGOYEN Y JOSE MARIA PAZ,-34.529024,-58.491708
,PLAN INTEGRAL DE MANTENIMIENTO DE PAVIMENTOS EN EL PARTIDO,PLUVIALES - PAVIMENTO,C&E CONSTRUCCIONES S.A,3070828836,"$ 70,000,000.00",86,"$ 69,882,349.88",VICENTE LOPEZ,-34.511135,-58.490334
,INFRAESTRUCTURA BARRIO LAS FLORES ETAPA 2,VIVIENDA SOCIAL,PF COMPAÑIA CONSTRUCTORA S.A.,3071101956,"$ 73,743,197.00",EN EJECUCION,"$ 76,746,676.89","BARRIO LAS FLORES, VILLA MARTELLI",-34.549792,-58.523196
,PUESTA EN VALOR DE LAS OFICINAS DE HACIENDA Y FINANZAS Y ATENCION A PROVEEDORES,OBRAS,SALBACO S.A.,3071543177,"$ 1,000,000.00",61,"$ 1,196,954.75","AV. MAIPU 2609, OLIVOS",-34.511135,-58.490334
,INFRAESTRUCTURA ELECTRICA EN EL BARRIO LAS FLORES,ELECTROMECANICA,COMPAÑÍA INTEGRAL DE ILUMINACION S.A.,3068055307,"$ 1,166,000.00",138,"$ 11,660,000.00","BARRIO LAS FLORES, VILLA MARTELLI",-34.549792,-58.523196
,PUESTA EN VALOR VEREDAS Y ACERAS BARRIO LAS FLORES,VIVIENDA SOCIAL,CASA MACCHI S.A.,3060812520,"$ 14,866,000.00",EN EJECUCION,"$ 15,601,955.00","BARRIO LAS FLORES, VILLA MARTELLI",-34.549792,-58.523196
,"EJECUCION DE OFICINAS Y AREAS DE SERVICIOS UBICADAS EN LA CALLE CAMPICHUELO 401, VILLA MARTELLI",OBRAS,MERLINO LUIS ALBERTO,2010365277,"$ 23,000,000.00",EN EJECUCION,"$ 20,930,730.71","CAMPICHUELO 401, VILLA MARTELLI",-34.544495,-58.499446
,EJECUCION DE OFICINAS Y AREAS DE SERVICIOS UBICADA EN LA CALLE ACASSUSO 1750,OBRAS,"CONSTRUCTORA SOLANA S.A,",3071431833,"$ 7,100,000.00",EN EJECUCION,"$ 7,430,594.52","ACASSUSO 1750, OLIVOS",-34.506572,-58.49603
,INFRAESTRUCTURA BARRIO LAS FLORES ETAPA 1,VIVIENDA SOCIAL,CUNUMI S.A.,3061574803,"$ 18,672,000.00",180,"$ 18,399,450.00","BARRIO LAS FLORES, VILLA MARTELLI",-34.549792,-58.523196
,PUESTA EN VALOR CALLE MELO BARRIO LAS FLORES,VIVIENDA SOCIAL,PF COMPAÑIA CONSTRUCTORA S.A.,3071101956,"$ 1,566,250.00",162,"$ 1,712,874.38","BARRIO LAS FLORES, VILLA MARTELLI",-34.549792,-58.523196
,INTERVENCION ESPACIOS VERDES BARRIO LAS FLORES,VIVIENDA SOCIAL,URBASER ARGENTINA S.A.,3068225650,"$ 3,762,000.00",198,"$ 3,756,252.46","BARRIO LAS FLORES, VILLA MARTELLI",-34.549792,-58.523196
,CONSTRUCCION DE PLAZAS BARRIO EL CEIBO,VIVIENDA SOCIAL,KIDE CONSTRUCCIONES S.R.L.,3071151035,"$ 4,851,420.00",245,"$ 4,814,810.42","BARRIO EL CEIBO, LA LUCILA",-34.493903,-58.480743
,CONTRUCCION CONDUCTO CALLE MADERO,PLUVIALES - PAVIMENTO,PF COMPAÑIA CONSTRUCTORA S.A.,3071101956,"$ 13,000,000.00",153,"$ 12,983,218.01",GASPAR CAMPOS Y LAPRIDA,-34.533115,-58.472326
,REPARACION PLAYON DE PATIN EN EL CAMPO DE DEPORTES N°1,DEPORTES,BENEDETTO HECTOR FABIAN,2021477625,"$ 1,000,000.00",31,"$ 1,225,000.00","DORREGO 2443, OLIVOS",-34.514697,-58.503573
,PUESTA EN VALOR PLAZA DE LA INTEGRACION DEL INSTITUTO BIGNONE,OBRAS,KIDE CONSTRUCCIONES S.R.L.,3071151035,"$ 2,300,000.00",219,"$ 2,086,460.25","MARTIN HAEDO 1426, OLIVOS",-34.528159,-58.479668
,EJECUCION DE CANCHA DE FUTBOL DEL RETEN U23,DEPORTES,TECNOFIELD S.A.,3071065427,"$ 8,220,000.00",261,"$ 8,219,845.00","SANTA CRUZ ESQUINA NEUQUEN, MUNRO",-34.539541,-58.536295
,EJECUCION DE CIRCUITO DE BMX EN EL PASEO COSTERO,DEPORTES,RACING EXPERIENCE S.A.,3071422026,"$ 9,000,000.00",EN EJECUCION,"$ 8,915,576.00",RICARDO ALFONSIN ENTRE MELO Y LAVALLE,-34.525269,-58.46713
,REFORMAS EN LA SALA DE PROYECCION EN EL CENTRO CULTURAL MUNRO,CULTURA,KANRE S.A.,3071426897,"$ 780,000.00",EN EJECUCION,"$ 713,900.00","AV. VELEZ SARSFIELD 4650, MUNRO",-34.530349,-58.523962
,EJECUCION DE SUM EN SOCIEDAD DE FOMENTO H. YRIGOYEN,PRESUPUESTO PARTICIPATIVO,ARQUINGHAM S.R.L.,3059846981,"$ 3,297,000.00",EN EJECUCION,"$ 3,480,316.79","HIPOLITO YRIGOYEN 4567, FLORIDA OESTE",-34.538872,-58.52236
,AMPLIACION DE SUPERFICIE SEMICUBIERTA Y REMODELACION DE NUCLEOS SANITARIOS EN LA ESCUELA TECNICA N°1,PRESUPUESTO PARTICIPATIVO,SALBACO S.A.,3071543177,"$ 2,000,000.00",EN EJECUCION,"$ 2,390,187.90","CERRITO 3966, VILLA ADELINA",-34.529205,-58.549945
,"EJECUCION DE OBRA CIVIL, PROVISION E INSTALACION DE ASCENSOR EN LA SOCIEDAD DE FOMENTO ARISTOBULO DEL VALLE",PRESUPUESTO PARTICIPATIVO,KANRE S.A.,3071426897,"$ 2,350,000.00",EN EJECUCION,"$ 2,569,000.00","AGUSTIN ALVAREZ 1538, FLORIDA",-34.533967,-58.479188
,EJECUCION DE BIBLIOTECA TECNOLOGICA PUBLICA - ETAPA 1,PRESUPUESTO PARTICIPATIVO,KIDE CONSTRUCCIONES S.R.L.,3071151035,"$ 2,100,000.00",EN EJECUCION,"$ 2,199,921.54","CARLOS TEJEDOR 2761, MUNRO",-34.528521,-58.525743
,EJECUCION DE INSTALACION ELECTRICA EN EL SUM DE LA ESCUELA DE CAPACITACION DOCENTE N°39,PRESUPUESTO PARTICIPATIVO,KANRE S.A.,3071426897,"$ 980,000.00",EN EJECUCION,"$ 985,000.00","AGUSTIN ALVAREZ 1459, VICENTE LOPEZ",-34.533251,-58.478001
,EJECUCION DE PRECEPTORIA EN EL JARDIN MATERNAL N°8,PRESUPUESTO PARTICIPATIVO,KIDE CONSTRUCCIONES S.R.L.,3071151035,"$ 1,220,000.00",EN EJECUCION,"$ 1,219,790.01","SANTA ROSA 4148, FLORIDA OESTE",-34.533248,-58.478004
,PUESTA EN VALOR DE SANITARIOS EN 1° PISO EN LA ESCUELA PRIMARIA N°16,PRESUPUESTO PARTICIPATIVO,SALBACO S.A.,3071543177,"$ 2,000,000.00",EN EJECUCION,"$ 1,930,030.79","ANCHORENA 901, LA LUCILA",-34.499543,-58.490639
,"PUESTA EN VALOR PLAZA HECTOR ""TOTO"" GONZALEZ",OBRAS,KIDE CONSTRUCCIONES S.R.L.,3071151035,"$ 2,800,000.00",EN EJECUCION,"$ 2,799,210.77",ESTACION FLORIDA ESTE ENTRE VERGARA Y JUAN JOSE DE URQUIZA,-34.53136,-58.494368
,PUESTA EN VALOR PLAZOLETA MIGUEL AGUIRRE - HEROE DE MALVINAS,OBRAS,URBASER ARGENTINA S.A.,3068225650,"$ 4,700,000.00",EN EJECUCION,"$ 4,569,970.81","AV. SAN MARTIN 2442, FLORIDA",-34.529519,-58.494882
,EJECUCION DE RAMPAS EN DIVERSOS SECTORES DE LA LUCILA Y OLIVOS,PRESUPUESTO PARTICIPATIVO,CASA MACCHI S.A.,3060812520,"$ 2,280,000.00",95,"$ 2,272,918.45",VICENTE LOPEZ,-34.511135,-58.490334
,EJECUCION DE CAMARA TRANSFORMADORA PARA LA MATERNIDAD SANTA ROSA,SALUD,KIDE CONSTRUCCIONES S.R.L.,3071151035,"$ 1,200,000.00",114,"$ 1,199,676.83","HAEDO 4150, FLORIDA OESTE",-34.543862,-58.512607
,PUESTA EN VALOR DEL SALON DE ACTOS EN LA ESCUELA PRIMARIA N°18,PRESUPUESTO PARTICIPATIVO,KIDE CONSTRUCCIONES S.R.L.,3071151035,"$ 2,000,000.00",53,"$ 937,017.40","RAMON CASTRO 5615, CARAPACHAY",-34.527039,-58.534791
,EJECUCION DE SANITARIOS Y DEPOSITO EN SUM DE PLAZA SOLDADO ARGENTINO AVAPEA,PRESUPUESTO PARTICIPATIVO,ARQUINGHAM S.R.L.,3059846981,"$ 1,200,000.00",EN EJECUCION,"$ 1,407,809.64","SANTIAGO DEL ESTERO 6703-6755, VILLA ADELINA",-34.530194,-58.550659
,PUESTA EN VALOR DE SANITARIOS Y OBRAS VARIAS EN LA ESCUELA PRIMARIA N°2,PRESUPUESTO PARTICIPATIVO,KIDE CONSTRUCCIONES S.R.L.,3071151035,"$ 1,650,000.00",51,"$ 1,645,035.96","PELLIZA 1390, OLIVOS",-34.507938,-58.491062
